<?xml version="1.0" encoding="utf-8" ?>
<Configuration xmlns="https://libracore.com/xml/HostingChecker/config.xsd"
          xmlns:xsi="http://www.w3.org/2001/XMLSchema-instance"
          xsi:schemaLocation="https://libracore.com/xml/HostingChecker/config.xsd config.xsd">
  <!-- Domain resources to check-->
  <Domains>
    <Resource>http://www.exmaple.com</Resource>
  </Domains>

  <!-- Statistics MySQL server -->
  <Server>localhost</Server>
  <Port>3306</Port>
  <Username>hostingchecker</Username>
  <Password>hostingchecker123</Password>
  <Schema>hostingchecker</Schema>
</Configuration>